<?xml version="1.0" encoding="UTF-8"?>
<!--Sample XML file generated by XMLSpy v2018 rel. 2 sp1 (x64) (http://www.altova.com)-->
<mt:Samples xmlns:mt="urn:mtconnect.org:MTConnectStreams:1.5" xmlns:xsi="http://www.w3.org/2001/XMLSchema-instance" xsi:schemaLocation="urn:mtconnect.org:MTConnectStreams:1.5 dataset.xsd">
  <mt:VariableDataSet sequence="12344" timestamp="2019-01-01T20:00:00Z">
    <mt:Entry key="a">dddd</mt:Entry>
    <mt:Entry key="n">dddd</mt:Entry>
  </mt:VariableDataSet>
  <mt:VariableDataSet sequence="12344" timestamp="2019-01-01T20:00:00Z" count="0">
  UNAVAILABLE
  </mt:VariableDataSet>
  <mt:Variable sequence="12431" timestamp="2019-01-01T20:00:00Z">xaa="das\"dsasd" v="ad sa" d=add r={fdasfd\} dd} d='daf  d\'as' r="abc\"def" </mt:Variable>
  <mt:Variable sequence="12431" timestamp="2019-01-01T20:00:00Z"></mt:Variable>
  <mt:Variable sequence="12431" timestamp="2019-01-01T20:00:00Z">UNAVAILABLE</mt:Variable>
</mt:Samples>
